id,Title,Author,Permalink
9002,"Monthly round-up",18,http://www.astrobetter.com/?p=9002
9007,"Claiming Papers And Finding People with ORCID",10,http://www.astrobetter.com/blog/2016/03/07/claiming-papers-and-finding-people-with-orcid/
9019,"LGBT Climate in Physics",18,http://www.astrobetter.com/blog/2016/03/16/lgbt-climate-in-physics/
9023,"An Open, Online Astronomy Thesis Collection",10,http://www.astrobetter.com/blog/2016/04/11/an-open-online-astronomy-thesis-collection/
9034,"Wiki Update: Diversity Programs",18,http://www.astrobetter.com/blog/2016/05/13/wiki-update-diversity-programs/
9039,"Introducing the McCrady & Rice Labs: Concept-Oriented Collaborative Activities for Astronomy 101",10,http://www.astrobetter.com/blog/2016/06/13/introducing-the-mccrady-rice-labs-concept-oriented-collaborative-activities-for-astronomy-101/
9044,"MATISSE, the ASDC web-tool for the planetary exploration",10,http://www.astrobetter.com/blog/2016/06/27/matisse-the-asdc-web-tool-for-the-planetary-exploration/
9062,"Twitter at Conferences, Part 1: Non-tweeters",10,http://www.astrobetter.com/blog/2016/07/06/twitter-at-conferences-part-1-non-tweeters/
9070,"Managing Citations (Collaboratively) in Google Docs",10,http://www.astrobetter.com/blog/2016/07/11/managing-citations-collaboratively-in-google-docs/
9076,"Twitter at Conferences, Part 2: Twitter users",10,http://www.astrobetter.com/blog/2016/07/13/twitter-at-conferences-part-2-twitter-users/
9082,"Twitter at Conferences, Part 3: LOC & SOC",10,http://www.astrobetter.com/blog/2016/07/20/twitter-at-conferences-part-3-loc-soc/
9093,"Super Charge your ADS Searches with Filters",10,http://www.astrobetter.com/blog/2016/08/01/super-charge-your-ads-searches-with-filters/
9107,"Rumor Mill Update: 2016",18,http://www.astrobetter.com/blog/2016/09/07/rumor-mill-update-2016/
9109,"A Workshop for Early-Career Astronomers Who Want to Do Better Outreach",10,http://www.astrobetter.com/blog/2016/09/09/a-workshop-for-early-career-astronomers-who-want-to-do-better-outreach/
9113,"The Performing Art of Science Presentation at AAS 229",10,http://www.astrobetter.com/blog/2016/09/14/the-performing-art-of-science-presentation-at-aas-229/
9122,"Using Python for Astronomical Data Analysis in the Era of JWST",10,http://www.astrobetter.com/blog/2016/09/26/using-python-for-astronomical-data-analysis-in-the-era-of-jwst/
9128,"Learn Software Carpentry at #AAS229",10,http://www.astrobetter.com/blog/2016/09/27/learn-software-carpentry-at-aas229/
9130,"Added macOS Sierra Setup Notes",4,http://www.astrobetter.com/?p=9130
9140,"Advice from a Faculty Hiring Committee Chair",10,http://www.astrobetter.com/blog/2017/01/19/advice-from-a-faculty-hiring-committee-chair/
9142,"Register for Hack Together Day at AAS 229",10,http://www.astrobetter.com/blog/2016/12/09/register-for-hack-together-day-at-aas-229/
9148,"AAS Winter Meeting Cheat Sheet #AAS229",18,http://www.astrobetter.com/blog/2016/12/16/aas-winter-meeting-cheat-sheet-aas229/
9155,"Is an R1 for you?",10,http://www.astrobetter.com/blog/2017/02/13/is-an-r1-for-you/
9163,"Rumor Mill is now ready for 2017–2018",3,http://www.astrobetter.com/blog/2017/09/25/rumor-mill-is-now-ready-for-2017-2018/
9174,"STARtorialist BOOTH-tique at AAS 231",10,http://www.astrobetter.com/blog/2017/12/12/startorialist-booth-tique-at-aas-231/
